{
  "$schema": "./schema.json",
  "schemaVersion": "1.0.0",
  "generatedAt": "2026-08-03",
  "sources": [
    {
      "id": "kimi-k3-pinned-model-card",
      "title": "Kimi K3 pinned model card",
      "publisher": "Moonshot AI",
      "url": "https://huggingface.co/moonshotai/Kimi-K3/blob/9f62e4e9fffbd0a83ddd60e1c209d828994b3569/README.md",
      "retrievedAt": "2026-08-03",
      "sourceType": "official_model_card",
      "artifactSnapshot": {
        "repository": "moonshotai/Kimi-K3",
        "revision": "9f62e4e9fffbd0a83ddd60e1c209d828994b3569"
      }
    },
    {
      "id": "deepseek-v4-pro-pinned-model-card",
      "title": "DeepSeek V4 Pro pinned model card",
      "publisher": "DeepSeek",
      "url": "https://huggingface.co/deepseek-ai/DeepSeek-V4-Pro/blob/b5968e9190ef611bbf34a7229255be88a0e937c1/README.md",
      "retrievedAt": "2026-08-03",
      "sourceType": "official_model_card",
      "artifactSnapshot": {
        "repository": "deepseek-ai/DeepSeek-V4-Pro",
        "revision": "b5968e9190ef611bbf34a7229255be88a0e937c1"
      }
    },
    {
      "id": "deepseek-v4-technical-report",
      "title": "DeepSeek-V4: Towards Highly Efficient Million-Token Context Intelligence",
      "publisher": "DeepSeek-AI",
      "url": "https://arxiv.org/pdf/2606.19348v1",
      "retrievedAt": "2026-08-03",
      "sourceType": "technical_report"
    },
    {
      "id": "glm-5-2-pinned-model-card",
      "title": "GLM-5.2 pinned model card",
      "publisher": "Z.ai",
      "url": "https://huggingface.co/zai-org/GLM-5.2/blob/b4734de4facf877f85769a911abafc5283eab3d9/README.md",
      "retrievedAt": "2026-08-03",
      "sourceType": "official_model_card",
      "artifactSnapshot": {
        "repository": "zai-org/GLM-5.2",
        "revision": "b4734de4facf877f85769a911abafc5283eab3d9"
      }
    },
    {
      "id": "gemma-4-26b-a4b-it-pinned-model-card",
      "title": "Gemma 4 26B A4B IT pinned model card",
      "publisher": "Google DeepMind",
      "url": "https://huggingface.co/google/gemma-4-26B-A4B-it/blob/4d7ae4984b7db7de8f8457170b3f1a419ee76d52/README.md",
      "retrievedAt": "2026-08-03",
      "sourceType": "official_model_card",
      "artifactSnapshot": {
        "repository": "google/gemma-4-26B-A4B-it",
        "revision": "4d7ae4984b7db7de8f8457170b3f1a419ee76d52"
      }
    },
    {
      "id": "gemma-4-technical-report",
      "title": "Gemma 4 Technical Report",
      "publisher": "Gemma Team, Google DeepMind",
      "url": "https://arxiv.org/pdf/2607.02770v1",
      "retrievedAt": "2026-08-03",
      "sourceType": "technical_report"
    },
    {
      "id": "qwen3-30b-a3b-pinned-model-card",
      "title": "Qwen3-30B-A3B pinned model card",
      "publisher": "Qwen Team",
      "url": "https://huggingface.co/Qwen/Qwen3-30B-A3B/blob/ad44e777bcd18fa416d9da3bd8f70d33ebb85d39/README.md",
      "retrievedAt": "2026-08-03",
      "sourceType": "official_model_card",
      "artifactSnapshot": {
        "repository": "Qwen/Qwen3-30B-A3B",
        "revision": "ad44e777bcd18fa416d9da3bd8f70d33ebb85d39"
      }
    },
    {
      "id": "qwen3-technical-report",
      "title": "Qwen3 Technical Report",
      "publisher": "Qwen Team",
      "url": "https://arxiv.org/pdf/2505.09388v1",
      "retrievedAt": "2026-08-03",
      "sourceType": "technical_report"
    },
    {
      "id": "lm-eval-v0-4-12-source",
      "title": "EleutherAI lm-evaluation-harness v0.4.12 pinned source",
      "publisher": "EleutherAI",
      "url": "https://github.com/EleutherAI/lm-evaluation-harness/tree/6d642546f4688648fced259eb3302efd36ece5af",
      "retrievedAt": "2026-08-03",
      "sourceType": "adapter_repository"
    }
  ],
  "adapters": [
    {
      "id": "lm-eval-v0-4-12",
      "name": "EleutherAI lm-evaluation-harness",
      "kind": "lm_eval",
      "packageName": "lm-eval",
      "version": "0.4.12",
      "repositoryUrl": "https://github.com/EleutherAI/lm-evaluation-harness",
      "revision": "6d642546f4688648fced259eb3302efd36ece5af",
      "revisionUrl": "https://github.com/EleutherAI/lm-evaluation-harness/tree/6d642546f4688648fced259eb3302efd36ece5af",
      "status": "pinned_not_executed",
      "sourceIds": [
        "lm-eval-v0-4-12-source"
      ]
    }
  ],
  "reportedClaims": [
    {
      "id": "kimi-k3-gpqa-diamond-owner-reported",
      "claimType": "owner_reported",
      "modelId": "kimi-k3",
      "modelName": "Kimi K3",
      "owner": "Moonshot AI",
      "artifact": {
        "repository": "moonshotai/Kimi-K3",
        "revision": "9f62e4e9fffbd0a83ddd60e1c209d828994b3569"
      },
      "artifactAssociation": "artifact_snapshot_associated",
      "executionArtifactDigest": null,
      "benchmark": {
        "suite": "GPQA",
        "version": null,
        "subset": "Diamond"
      },
      "metric": {
        "name": "owner-reported score",
        "value": 93.5,
        "unit": "reported_score",
        "scale": "0-100 as presented",
        "direction": "higher_is_better"
      },
      "evaluation": {
        "mode": "max",
        "reportedSettings": [
          {
            "name": "reasoning_effort",
            "value": "max"
          },
          {
            "name": "temperature",
            "value": 1
          },
          {
            "name": "top_p",
            "value": 0.95
          }
        ]
      },
      "sourceRefs": [
        {
          "sourceId": "kimi-k3-pinned-model-card",
          "locator": "Section 3, Evaluation Results, GPQA Diamond row; Footnotes common settings"
        }
      ],
      "comparisonEligible": false,
      "missingContext": [
        "The owner does not explicitly label the score as a percentage or define the metric scale.",
        "Shot count, sample count, prompt, and benchmark revision are not reported.",
        "Inference engine, runtime configuration, and hardware are not reported.",
        "The provider does not publish a digest of the tensor artifact used for the evaluation."
      ]
    },
    {
      "id": "kimi-k3-terminal-bench-2-1-owner-reported",
      "claimType": "owner_reported",
      "modelId": "kimi-k3",
      "modelName": "Kimi K3",
      "owner": "Moonshot AI",
      "artifact": {
        "repository": "moonshotai/Kimi-K3",
        "revision": "9f62e4e9fffbd0a83ddd60e1c209d828994b3569"
      },
      "artifactAssociation": "artifact_snapshot_associated",
      "executionArtifactDigest": null,
      "benchmark": {
        "suite": "Terminal-Bench",
        "version": "2.1",
        "subset": null
      },
      "metric": {
        "name": "owner-reported score",
        "value": 88.3,
        "unit": "reported_score",
        "scale": "0-100 as presented",
        "direction": "higher_is_better"
      },
      "evaluation": {
        "mode": "max",
        "reportedSettings": [
          {
            "name": "reasoning_effort",
            "value": "max"
          },
          {
            "name": "temperature",
            "value": 1
          },
          {
            "name": "top_p",
            "value": 1
          },
          {
            "name": "harness",
            "value": "Kimi Code"
          }
        ]
      },
      "sourceRefs": [
        {
          "sourceId": "kimi-k3-pinned-model-card",
          "locator": "Section 3, Evaluation Results, Terminal-Bench 2.1 row; Footnotes coding benchmarks"
        }
      ],
      "comparisonEligible": false,
      "missingContext": [
        "The owner does not explicitly label the score as a percentage or define the metric scale.",
        "The Kimi Code harness version and full harness configuration are not reported.",
        "Task revision, trial count, and aggregation method are not reported.",
        "Inference engine and hardware are not reported.",
        "The provider does not publish a digest of the tensor artifact used for the evaluation."
      ]
    },
    {
      "id": "kimi-k3-browsecomp-owner-reported",
      "claimType": "owner_reported",
      "modelId": "kimi-k3",
      "modelName": "Kimi K3",
      "owner": "Moonshot AI",
      "artifact": {
        "repository": "moonshotai/Kimi-K3",
        "revision": "9f62e4e9fffbd0a83ddd60e1c209d828994b3569"
      },
      "artifactAssociation": "artifact_snapshot_associated",
      "executionArtifactDigest": null,
      "benchmark": {
        "suite": "BrowseComp",
        "version": null,
        "subset": null
      },
      "metric": {
        "name": "owner-reported score",
        "value": 91.2,
        "unit": "reported_score",
        "scale": "0-100 as presented",
        "direction": "higher_is_better"
      },
      "evaluation": {
        "mode": "max",
        "reportedSettings": [
          {
            "name": "reasoning_effort",
            "value": "max"
          },
          {
            "name": "temperature",
            "value": 1
          },
          {
            "name": "top_p",
            "value": 1
          },
          {
            "name": "context_compaction_trigger_tokens",
            "value": 300000
          }
        ]
      },
      "sourceRefs": [
        {
          "sourceId": "kimi-k3-pinned-model-card",
          "locator": "Section 3, Evaluation Results, BrowseComp row; Footnotes BrowseComp context-compaction setting"
        }
      ],
      "comparisonEligible": false,
      "missingContext": [
        "The owner does not explicitly label the score as a percentage or define the metric scale.",
        "The browsing tool implementation, harness version, and context-compaction algorithm are not reported.",
        "Benchmark revision, trial count, and aggregation method are not reported.",
        "Inference engine and hardware are not reported.",
        "The provider does not publish a digest of the tensor artifact used for the evaluation."
      ]
    },
    {
      "id": "deepseek-v4-pro-gpqa-diamond-owner-reported",
      "claimType": "owner_reported",
      "modelId": "deepseek-v4-pro",
      "modelName": "DeepSeek V4 Pro",